{
  "schema_version": "0.2.0",
  "request_id": "CONTRACT-AUDIT-CASE-002",
  "user_id": "audit-case-002",
  "tenant_id": "validation-tokyo-2026",
  "question": "Should I build an AI startup in Tokyo or continue employment?",
  "constraints": {},
  "desired_outcome": "Contract audit CASE-002",
  "user_intent": "Should I build an AI startup in Tokyo or continue employment?",
  "workspace_id": "ws-web-audit-case-002"
}
