{
  "schema_version": "0.2.0",
  "request_id": "CONTRACT-AUDIT-CASE-001",
  "user_id": "audit-case-001",
  "tenant_id": "validation-tokyo-2026",
  "question": "how to apply japan highly skilled visa",
  "constraints": {},
  "desired_outcome": "Contract audit CASE-001",
  "user_intent": "how to apply japan highly skilled visa",
  "workspace_id": "ws-web-audit-case-001"
}
